{
  "heading": "Contact The Pet Studio",
  "subheading": "Whether you are booking a grooming appointment or exploring professional dog grooming training, we would love to hear from you.",
  "grooming_heading": "Book a Grooming Appointment",
  "phone": "01934 90 60 80",
  "phone_cta_text": "Call the Salon",
  "intro_text": "Every dog is different, so we take the time to understand their breed, coat, age, temperament and grooming history before arranging an appointment. Calling the salon allows us to ask the right questions, recommend the most suitable service and make sure we allow enough time for your dog’s individual needs.\n\nPlease let us know if your dog is a puppy, elderly, nervous, has previously struggled with grooming or has any medical or behavioural information that may help us prepare. The more we know in advance, the better we can make the experience for your dog.",
  "academy_section_heading": "Thinking About Dog Grooming Training?",
  "academy_section_intro": "Choosing the right course is an important decision, particularly if you are considering a career change or hoping to start a dog grooming business of your own.\n\nComplete the enquiry form and tell us a little about your experience, your goals and the course you are interested in. You will receive an email with the next steps and a link to arrange a conversation with Liza. This gives you the opportunity to ask questions, understand what the training involves and decide whether the course is the right fit before making any commitment.",
  "academy_heading": "Dog Grooming Training Enquiry",
  "academy_intro": "Tell us a little about yourself and what you would like to achieve. Liza will then be able to give you clear, personalised guidance on the most suitable course and your next steps.",
  "form_shortcode": "",
  "recipient_email": "",
  "email_subject": "Dog Grooming Training enquiry",
  "button_text": "Send My Enquiry",
  "success_message": "Thank you for getting in touch. Please check your inbox for an email explaining the next steps and how to arrange a conversation with Liza.",
  "show_enquiry_type": false,
  "message_required": true,
  "first_name_label": "First Name",
  "last_name_label": "Last Name",
  "email_label": "Email Address",
  "phone_label": "Telephone Number",
  "message_label": "Tell us about your goals",
  "message_placeholder": "Please tell us which course interests you, whether you have any previous grooming experience and what you hope to achieve.",
  "privacy_text": "We will only use your details to respond to your enquiry. Please see our Privacy Policy for more information.",
  "privacy_link": {
    "url": "/privacy-policy/",
    "is_external": false,
    "nofollow": false
  },
  "visit_heading": "Find Us in Congresbury",
  "address": "2 High Street\nCongresbury\nNorth Somerset\nBS49 5JA",
  "opening_hours": "Monday to Friday\n9am–4pm",
  "visit_body": "The Pet Studio is conveniently located in Congresbury and welcomes dog owners and students from across North Somerset, Bristol and the surrounding areas. Please arrange an appointment before visiting so we can make sure the right member of the team is available to help you.",
  "maps_button_text": "Open in Google Maps",
  "maps_link": {
    "url": "https://maps.google.com/?q=The+Pet+Studio+Congresbury",
    "is_external": true,
    "nofollow": false
  },
  "sticky_image": {
    "id": 0,
    "url": "https://thepetstudio.local/wp-content/uploads/pet-studio/media/photos/general/contact-sticky.jpg"
  },
  "mobile_image": {
    "id": 0,
    "url": "https://thepetstudio.local/wp-content/uploads/pet-studio/media/photos/general/contact-sticky.jpg"
  },
  "map_lat": "51.3703",
  "map_lng": "-2.8091",
  "map_zoom": 15,
  "map_marker_title": "The Pet Studio, Congresbury"
}
